{
  "version": 1,
  "canvas": {"width": 96, "height": 96},
  "palette": [
    "#090d22", "#151a3d", "#292453", "#493364", "#76518a", "#c86f7d",
    "#f2a97f", "#ffd6a5", "#ffe9bd", "#67c7d9", "#c6f1e7", "#333050"
  ],
  "frames": [
    {
      "name": "breathe-0", "duration": 130,
      "layers": [
        {"name": "sky", "commands": [
          {"op": "rect", "x": 0, "y": 0, "width": 96, "height": 96, "color": 0},
          {"op": "rect", "x": 0, "y": 47, "width": 96, "height": 30, "color": 1},
          {"op": "pixel", "x": 8, "y": 11, "color": 10}, {"op": "pixel", "x": 19, "y": 23, "color": 8},
          {"op": "pixel", "x": 31, "y": 8, "color": 10}, {"op": "pixel", "x": 45, "y": 16, "color": 8},
          {"op": "pixel", "x": 79, "y": 7, "color": 10}, {"op": "pixel", "x": 87, "y": 27, "color": 8},
          {"op": "pixel", "x": 14, "y": 37, "color": 4}, {"op": "pixel", "x": 37, "y": 30, "color": 4},
          {"op": "pixel", "x": 73, "y": 38, "color": 4}, {"op": "pixel", "x": 91, "y": 17, "color": 4}
        ]},
        {"name": "moon-and-mist", "commands": [
          {"op": "ellipse", "x": 61, "y": 10, "width": 25, "height": 25, "color": 7},
          {"op": "ellipse", "x": 64, "y": 12, "width": 18, "height": 19, "color": 8},
          {"op": "polygon", "points": [[64,13],[70,14],[68,18],[71,20],[67,23],[63,21]], "color": 7},
          {"op": "polygon", "points": [[55,38],[72,35],[88,38],[96,44],[96,49],[78,45],[63,47],[48,45]], "color": 2},
          {"op": "line", "x1": 55, "y1": 39, "x2": 92, "y2": 42, "color": 3},
          {"op": "polygon", "points": [[0,48],[17,44],[31,46],[43,51],[33,53],[12,51]], "color": 2}
        ]},
        {"name": "city", "commands": [
          {"op": "polygon", "points": [[0,62],[7,58],[13,60],[18,52],[24,57],[29,50],[36,61],[42,55],[49,63],[57,58],[64,62],[71,54],[77,60],[84,50],[91,57],[96,53],[96,83],[0,83]], "color": 2},
          {"op": "rect", "x": 4, "y": 64, "width": 11, "height": 20, "color": 11},
          {"op": "rect", "x": 17, "y": 59, "width": 10, "height": 25, "color": 11},
          {"op": "rect", "x": 29, "y": 65, "width": 9, "height": 19, "color": 11},
          {"op": "rect", "x": 69, "y": 63, "width": 9, "height": 21, "color": 11},
          {"op": "rect", "x": 81, "y": 59, "width": 11, "height": 25, "color": 11},
          {"op": "pixel", "x": 7, "y": 69, "color": 6}, {"op": "pixel", "x": 11, "y": 74, "color": 9},
          {"op": "pixel", "x": 20, "y": 64, "color": 7}, {"op": "pixel", "x": 24, "y": 70, "color": 6},
          {"op": "pixel", "x": 33, "y": 70, "color": 9}, {"op": "pixel", "x": 73, "y": 68, "color": 7},
          {"op": "pixel", "x": 85, "y": 64, "color": 6}, {"op": "pixel", "x": 89, "y": 73, "color": 9}
        ]},
        {"name": "rooftop", "commands": [
          {"op": "polygon", "points": [[0,78],[14,74],[29,77],[42,73],[57,77],[69,74],[82,78],[96,75],[96,96],[0,96]], "color": 0},
          {"op": "line", "x1": 0, "y1": 79, "x2": 96, "y2": 77, "color": 4},
          {"op": "rect", "x": 5, "y": 85, "width": 25, "height": 3, "color": 1},
          {"op": "line", "x1": 9, "y1": 88, "x2": 6, "y2": 95, "color": 3},
          {"op": "line", "x1": 25, "y1": 88, "x2": 29, "y2": 95, "color": 3},
          {"op": "polygon", "points": [[70,80],[84,78],[92,81],[89,96],[66,96]], "color": 1},
          {"op": "line", "x1": 72, "y1": 84, "x2": 91, "y2": 82, "color": 3}
        ]},
        {"name": "courier", "commands": [
          {"op": "polygon", "points": [[43,48],[48,44],[55,46],[58,53],[56,61],[61,70],[55,74],[47,69],[40,71],[36,67],[40,59]], "color": 3},
          {"op": "polygon", "points": [[45,50],[51,46],[56,50],[55,56],[49,58],[43,55]], "color": 6},
          {"op": "rect", "x": 47, "y": 51, "width": 7, "height": 3, "color": 0},
          {"op": "rect", "x": 48, "y": 51, "width": 5, "height": 1, "color": 9},
          {"op": "pixel", "x": 46, "y": 55, "color": 7}, {"op": "pixel", "x": 54, "y": 55, "color": 7},
          {"op": "polygon", "points": [[45,58],[53,57],[58,65],[61,70],[55,72],[49,66],[45,69],[40,67]], "color": 5},
          {"op": "polygon", "points": [[43,58],[48,60],[45,71],[41,76],[37,75],[39,66]], "color": 2},
          {"op": "polygon", "points": [[51,65],[56,70],[55,78],[51,78],[50,71]], "color": 0},
          {"op": "polygon", "points": [[44,67],[48,69],[46,78],[42,78],[41,73]], "color": 0},
          {"op": "rect", "x": 40, "y": 78, "width": 8, "height": 2, "color": 7},
          {"op": "rect", "x": 50, "y": 78, "width": 8, "height": 2, "color": 7},
          {"op": "polygon", "points": [[53,59],[56,60],[62,65],[61,67],[56,64]], "color": 7},
          {"op": "rect", "x": 39, "y": 78, "width": 20, "height": 3, "color": 0},
          {"op": "rect", "x": 40, "y": 76, "width": 8, "height": 2, "color": 7},
          {"op": "rect", "x": 50, "y": 76, "width": 8, "height": 2, "color": 7}
        ]},
        {"name": "lantern-glow", "commands": [
          {"op": "polygon", "points": [[61,63],[67,61],[72,65],[70,72],[65,75],[60,71]], "color": 3},
          {"op": "rect", "x": 63, "y": 65, "width": 6, "height": 7, "color": 6},
          {"op": "rect", "x": 64, "y": 66, "width": 4, "height": 5, "color": 8},
          {"op": "line", "x1": 64, "y1": 62, "x2": 67, "y2": 60, "color": 7},
          {"op": "pixel", "x": 58, "y": 68, "color": 6}, {"op": "pixel", "x": 72, "y": 69, "color": 6}
        ]}
      ]
    },
    {
      "name": "breathe-1", "duration": 130,
      "layers": [
        {"name": "sky", "commands": [
          {"op": "rect", "x": 0, "y": 0, "width": 96, "height": 96, "color": 0}, {"op": "rect", "x": 0, "y": 47, "width": 96, "height": 30, "color": 1},
          {"op": "pixel", "x": 8, "y": 11, "color": 10}, {"op": "pixel", "x": 19, "y": 23, "color": 8}, {"op": "pixel", "x": 31, "y": 8, "color": 10}, {"op": "pixel", "x": 45, "y": 16, "color": 8}, {"op": "pixel", "x": 79, "y": 7, "color": 10}, {"op": "pixel", "x": 87, "y": 27, "color": 8}, {"op": "pixel", "x": 14, "y": 37, "color": 4}, {"op": "pixel", "x": 37, "y": 30, "color": 4}, {"op": "pixel", "x": 73, "y": 38, "color": 4}, {"op": "pixel", "x": 91, "y": 17, "color": 4}
        ]},
        {"name": "moon-and-mist", "commands": [
          {"op": "ellipse", "x": 61, "y": 10, "width": 25, "height": 25, "color": 7}, {"op": "ellipse", "x": 64, "y": 12, "width": 18, "height": 19, "color": 8}, {"op": "polygon", "points": [[64,13],[70,14],[68,18],[71,20],[67,23],[63,21]], "color": 7}, {"op": "polygon", "points": [[55,38],[72,35],[88,38],[96,44],[96,49],[78,45],[63,47],[48,45]], "color": 2}, {"op": "line", "x1": 55, "y1": 39, "x2": 92, "y2": 42, "color": 3}, {"op": "polygon", "points": [[0,48],[17,44],[31,46],[43,51],[33,53],[12,51]], "color": 2}
        ]},
        {"name": "city", "commands": [
          {"op": "polygon", "points": [[0,62],[7,58],[13,60],[18,52],[24,57],[29,50],[36,61],[42,55],[49,63],[57,58],[64,62],[71,54],[77,60],[84,50],[91,57],[96,53],[96,83],[0,83]], "color": 2}, {"op": "rect", "x": 4, "y": 64, "width": 11, "height": 20, "color": 11}, {"op": "rect", "x": 17, "y": 59, "width": 10, "height": 25, "color": 11}, {"op": "rect", "x": 29, "y": 65, "width": 9, "height": 19, "color": 11}, {"op": "rect", "x": 69, "y": 63, "width": 9, "height": 21, "color": 11}, {"op": "rect", "x": 81, "y": 59, "width": 11, "height": 25, "color": 11}, {"op": "pixel", "x": 7, "y": 69, "color": 6}, {"op": "pixel", "x": 11, "y": 74, "color": 9}, {"op": "pixel", "x": 20, "y": 64, "color": 7}, {"op": "pixel", "x": 24, "y": 70, "color": 6}, {"op": "pixel", "x": 33, "y": 70, "color": 9}, {"op": "pixel", "x": 73, "y": 68, "color": 7}, {"op": "pixel", "x": 85, "y": 64, "color": 6}, {"op": "pixel", "x": 89, "y": 73, "color": 9}
        ]},
        {"name": "rooftop", "commands": [
          {"op": "polygon", "points": [[0,78],[14,74],[29,77],[42,73],[57,77],[69,74],[82,78],[96,75],[96,96],[0,96]], "color": 0}, {"op": "line", "x1": 0, "y1": 79, "x2": 96, "y2": 77, "color": 4}, {"op": "rect", "x": 5, "y": 85, "width": 25, "height": 3, "color": 1}, {"op": "line", "x1": 9, "y1": 88, "x2": 6, "y2": 95, "color": 3}, {"op": "line", "x1": 25, "y1": 88, "x2": 29, "y2": 95, "color": 3}, {"op": "polygon", "points": [[70,80],[84,78],[92,81],[89,96],[66,96]], "color": 1}, {"op": "line", "x1": 72, "y1": 84, "x2": 91, "y2": 82, "color": 3}
        ]},
        {"name": "courier", "commands": [
          {"op": "polygon", "points": [[43,47],[48,43],[55,45],[58,52],[56,60],[61,69],[55,73],[47,68],[40,70],[36,66],[40,58]], "color": 3}, {"op": "polygon", "points": [[45,49],[51,45],[56,49],[55,55],[49,57],[43,54]], "color": 6}, {"op": "rect", "x": 47, "y": 50, "width": 7, "height": 3, "color": 0}, {"op": "rect", "x": 48, "y": 50, "width": 5, "height": 1, "color": 9}, {"op": "pixel", "x": 46, "y": 54, "color": 7}, {"op": "pixel", "x": 54, "y": 54, "color": 7}, {"op": "polygon", "points": [[45,57],[53,56],[59,64],[62,69],[56,71],[49,65],[45,68],[39,66]], "color": 5}, {"op": "polygon", "points": [[43,57],[48,59],[45,70],[41,75],[37,74],[39,65]], "color": 2}, {"op": "polygon", "points": [[51,64],[56,69],[55,78],[51,78],[50,70]], "color": 0}, {"op": "polygon", "points": [[44,66],[48,68],[46,78],[42,78],[41,72]], "color": 0}, {"op": "rect", "x": 40, "y": 78, "width": 8, "height": 2, "color": 7}, {"op": "rect", "x": 50, "y": 78, "width": 8, "height": 2, "color": 7}
        ]},
        {"name": "lantern-glow", "commands": [